{
  "$schema": "https://json-schema.org/draft/2020-12/schema",
  "$id": "https://urmzd.com/schemas/oap/artifact-envelope.json",
  "title": "Artifact Envelope",
  "description": "Wire-format message for the Open Artifact Protocol (OAP). Three envelope types: synthesize (in), edit (in), handle (out).",
  "type": "object",
  "required": ["protocol", "id", "version", "name", "meta", "content"],
  "properties": {
    "protocol": {
      "type": "string",
      "const": "oap/0.1",
      "description": "Protocol identifier and version"
    },
    "id": {
      "type": "string",
      "minLength": 1,
      "description": "Unique artifact identifier"
    },
    "version": {
      "type": "integer",
      "minimum": 1,
      "description": "Monotonically increasing version number. For edit operations, the apply engine validates stored_version == version - 1"
    },
    "name": {
      "type": "string",
      "enum": ["synthesize", "edit", "handle"],
      "description": "Operation discriminator. Input: synthesize, edit. Output: handle."
    },
    "meta": {
      "type": "object",
      "description": "Metadata about the action",
      "required": ["format"],
      "properties": {
        "format": {
          "type": "string",
          "pattern": "^[a-z]+/[a-z0-9.+-]+$",
          "description": "MIME type of the artifact content"
        },
        "tokens_used": {
          "type": "integer",
          "minimum": 0,
          "description": "Actual content tokens consumed"
        },
        "checksum": {
          "type": "string",
          "pattern": "^sha256:[a-f0-9]{64}$",
          "description": "SHA-256 hash of resolved content"
        },
        "state": {
          "type": "string",
          "enum": ["draft", "published", "archived"],
          "description": "Entity lifecycle state"
        }
      },
      "additionalProperties": true
    },
    "content": {
      "type": "array",
      "items": { "type": "object" },
      "description": "List of content objects — shape determined by name."
    }
  },
  "allOf": [
    {
      "if": { "properties": { "name": { "const": "synthesize" } } },
      "then": {
        "properties": {
          "content": {
            "items": {
              "required": ["body"],
              "properties": {
                "body": { "type": "string", "description": "Full artifact content" }
              }
            }
          }
        }
      }
    },
    {
      "if": { "properties": { "name": { "const": "edit" } } },
      "then": {
        "properties": {
          "content": {
            "items": { "$ref": "edit-operation.json" }
          }
        }
      }
    },
    {
      "if": { "properties": { "name": { "const": "handle" } } },
      "then": {
        "properties": {
          "content": {
            "items": {
              "required": ["id", "version"],
              "properties": {
                "id": { "type": "string", "description": "Artifact ID" },
                "version": { "type": "integer", "minimum": 1, "description": "Artifact version" },
                "token_count": { "type": "integer", "minimum": 0, "description": "Approximate token count of the full artifact" },
                "state": { "type": "string", "enum": ["draft", "published", "archived"] },
                "content": { "type": "string", "description": "Optional artifact content (when requested)" },
                "targets": {
                  "type": "array",
                  "items": {
                    "type": "object",
                    "required": ["id"],
                    "properties": {
                      "id": { "type": "string", "description": "Target identifier" },
                      "label": { "type": "string", "description": "Human-readable description" },
                      "accepts": { "type": "string", "description": "Hint about valid replacement content" }
                    },
                    "additionalProperties": false
                  },
                  "description": "Valid target IDs in the current artifact"
                }
              }
            }
          }
        }
      }
    }
  ]
}
