{
  "protocol": "oap/0.1",
  "id": "dashboard-001",
  "version": 2,
  "name": "edit",
  "meta": {
    "format": "text/html",
    "tokens_used": 42
  },
  "content": [
    {
      "op": "replace",
      "target": {"type": "id", "value": "revenue-value"},
      "content": "<span class=\"stat-value\">$15,720</span>"
    },
    {
      "op": "replace",
      "target": {"type": "id", "value": "user-count"},
      "content": "<span class=\"stat-value\">1,342</span>"
    }
  ]
}
