{
  "protocol": "oap/0.1",
  "id": "dashboard-001",
  "version": 1,
  "name": "synthesize",
  "meta": {
    "format": "text/html",
    "tokens_used": 210
  },
  "content": [
    {
      "body": "<!DOCTYPE html>\n<html>\n<head><title>Dashboard</title></head>\n<body>\n<oap:target id=\"stats\">\n<div class=\"stats\">\n  <div class=\"stat\"><span class=\"label\">Revenue</span><oap:target id=\"revenue-value\"><span class=\"stat-value\">$12,340</span></oap:target></div>\n  <div class=\"stat\"><span class=\"label\">Users</span><oap:target id=\"user-count\"><span class=\"stat-value\">1,205</span></oap:target></div>\n</div>\n</oap:target>\n<oap:target id=\"users-table\">\n<table>\n  <tr><th>Name</th><th>Email</th><th>Role</th></tr>\n  <tr><td>Alice</td><td>alice@example.com</td><td>Admin</td></tr>\n  <tr><td>Bob</td><td>bob@example.com</td><td>User</td></tr>\n</table>\n</oap:target>\n<oap:target id=\"orders-table\">\n<table>\n  <tr><th>Order</th><th>Product</th><th>Amount</th></tr>\n  <tr><td>#001</td><td>Widget</td><td>$29.99</td></tr>\n</table>\n</oap:target>\n</body>\n</html>"
    }
  ]
}
