{
  "protocol": "oap/0.1",
  "id": "config-001",
  "version": 2,
  "name": "edit",
  "meta": {
    "format": "application/json"
  },
  "content": [
    {
      "op": "replace",
      "target": {"type": "pointer", "value": "/database/host"},
      "content": "\"prod-db.example.com\""
    },
    {
      "op": "replace",
      "target": {"type": "pointer", "value": "/features/dark_mode"},
      "content": "true"
    },
    {
      "op": "delete",
      "target": {"type": "pointer", "value": "/deprecated_field"}
    }
  ]
}
